{
  "tool": "joern",
  "case_id": "r14-buffer-len-source-untrusted",
  "track": "defect",
  "findings": [
    {
      "scenario": "cwe-787",
      "severity": "important",
      "file": "ingest.c",
      "line": 14,
      "message": "joern CPG anchor match: memcpy(buf, payload, hdr_len); [check: joern-cpg]",
      "anchor": "memcpy(buf, payload, hdr_len);"
    },
    {
      "scenario": "cwe-787",
      "severity": "important",
      "file": "ingest.c",
      "line": 14,
      "message": "joern dangerous call: memcpy [check: joern-cpg]",
      "anchor": "(void)pkt; (void)buf[0];"
    },
    {
      "scenario": "cwe-787",
      "severity": "important",
      "file": "ingest.c",
      "line": 25,
      "message": "joern dangerous call: memcpy [check: joern-cpg]",
      "anchor": "(void)pkt; (void)buf[0];"
    }
  ],
  "version": "unknown"
}
