{
  "tool": "joern",
  "case_id": "c15-spsc-lockfree-queue",
  "track": "contract",
  "findings": [
    {
      "scenario": "cwe-787",
      "severity": "important",
      "file": "spsc.c",
      "line": 28,
      "message": "joern CPG anchor match: g_q[g_tail] = v; [check: joern-cpg]",
      "anchor": "g_q[g_tail] = v;"
    }
  ],
  "version": "unknown"
}
