{
  "tool": "joern",
  "case_id": "r09-double-free-errorpath",
  "track": "defect",
  "findings": [
    {
      "scenario": "cwe-415",
      "severity": "important",
      "file": "ctx.c",
      "line": 17,
      "message": "joern CPG anchor match: free(c->buf);       /* 锚点（must_find）：错误路径释放，但未 return */ [check: joern-cpg]",
      "anchor": "free(c->buf);       /* 锚点（must_find）：错误路径释放，但未 return */"
    },
    {
      "scenario": "cwe-415",
      "severity": "important",
      "file": "ctx.c",
      "line": 20,
      "message": "joern CPG anchor match: free(c->buf);           /* 锚点（must_find）：末尾再次释放 c->buf → 双重释放（cwe-415） */ [check: joern-cpg]",
      "anchor": "free(c->buf);           /* 锚点（must_find）：末尾再次释放 c->buf → 双重释放（cwe-415） */"
    },
    {
      "scenario": "cwe-787",
      "severity": "important",
      "file": "ctx.c",
      "line": 17,
      "message": "joern dangerous call: free [check: joern-cpg]",
      "anchor": "free(c->buf);       /* 清理已分配的缓冲 */"
    },
    {
      "scenario": "cwe-787",
      "severity": "important",
      "file": "ctx.c",
      "line": 20,
      "message": "joern dangerous call: free [check: joern-cpg]",
      "anchor": "free(c->buf);           /* 统一在出口释放 */"
    },
    {
      "scenario": "cwe-787",
      "severity": "important",
      "file": "ctx.c",
      "line": 33,
      "message": "joern dangerous call: free [check: joern-cpg]",
      "anchor": "free(c->buf);       /* 清理已分配的缓冲 */"
    },
    {
      "scenario": "cwe-787",
      "severity": "important",
      "file": "ctx.c",
      "line": 37,
      "message": "joern dangerous call: free [check: joern-cpg]",
      "anchor": "free(c->buf);"
    }
  ],
  "version": "unknown"
}
