{
  "tool": "codeql",
  "case_id": "r01-wrap-resume-bug",
  "track": "defect",
  "findings": [
    {
      "scenario": null,
      "severity": "important",
      "file": "cases/defect/r01-wrap-resume-bug/src/rlc.c",
      "line": 34,
      "message": "Comparison is always true because sn <= 255. [check: cpp/constant-comparison]",
      "anchor": "if (sn < AMAP_MOD) {"
    }
  ],
  "version": "unknown"
}
