{
  "tool": "klee",
  "track": "defect",
  "case_id": "r14-buffer-len-source-untrusted",
  "findings": [
    {
      "file": "src/ingest.c",
      "anchor": "memcpy(buf, payload, hdr_len);",
      "message": "memory error: out of bound pointer",
      "severity": "important",
      "line": 13,
      "function": "r14_ingest",
      "scenario": "cwe-787+cwe-125"
    }
  ],
  "version": "KLEE 3.2 (https://klee-se.org/)"
}