{
  "tool": "klee",
  "track": "defect",
  "case_id": "r01-wrap-resume-bug",
  "findings": [
    {
      "file": "src/rlc.c",
      "anchor": "return t->win[resume];",
      "message": "memory error: out of bound pointer",
      "severity": "important",
      "line": 24,
      "function": "resume_point",
      "scenario": "cwe-787+cwe-125"
    }
  ],
  "version": "KLEE 3.2 (https://klee-se.org/)"
}