{
  "tool": "joern",
  "case_id": "c12-intended-wrap-seq",
  "track": "contract",
  "findings": [
    {
      "scenario": "cwe-787",
      "severity": "important",
      "file": "seq.c",
      "line": 25,
      "message": "joern CPG anchor match: uint8_t pos = (uint8_t)(seq + idx);   /* 锚点（must_find）：pos 未对 SEQ_MOD 约简 */ [check: joern-cpg]",
      "anchor": "uint8_t pos = (uint8_t)(seq + idx);   /* 锚点（must_find）：pos 未对 SEQ_MOD 约简 */"
    }
  ],
  "version": "unknown"
}
